{
  "reportId": "valrep-quick-001-2026-08-18",
  "caseId": "quick-001",
  "validationDate": "2026-08-18",
  "validatorRoleVersion": "v2.0-simplified",
  "overallStatus": "pass",
  "summary": "Independent revalidation of quick-001-the-clock-in-the-locked-study under the simplified AI_IF Validator workflow. The case package passes structural JSON schema validation deterministically and satisfies all pre-runtime mystery design principles in docs/design-principles.md (solvability, Final Resolution Contract, motive proportionality, red herring discipline, and scope limits). Zero Blocker, Major, Minor, or Advisory defects exist.",
  "checks": [
    {
      "checkId": "chk-schema-validity",
      "category": "schema_validity",
      "status": "pass",
      "summary": "game-package.json passes deterministic structural validation against schemas/game-package.schema.json via tools/validate.py."
    },
    {
      "checkId": "chk-solvability-contract",
      "category": "missing_clue_path",
      "status": "pass",
      "summary": "Final Resolution Contract is complete. All required proof clues (clue-loose-service-panel, clue-clock-oil, clue-black-thread, clue-stopped-clock, clue-watch-in-clock) are reachable through valid discovery rules."
    },
    {
      "checkId": "chk-motive-proportionality",
      "category": "weak_motive",
      "status": "pass",
      "summary": "Culprit Thomas Greer has a clear, proportional financial debt motive for stealing the watch, supported by discoverable evidence (clue-thomas-money-note, evidence-thomas-note)."
    },
    {
      "checkId": "chk-red-herring-discipline",
      "category": "unfair_discovery_path",
      "status": "pass",
      "summary": "Celia Vance's pawn envelope (clue-celia-pawn-envelope) is a bounded red herring clearable via questioning (rule-red-herring)."
    },
    {
      "checkId": "chk-scope-budget",
      "category": "scope_pacing_issue",
      "status": "pass",
      "summary": "Quick mystery scope budget is strictly observed (1 location, 3 suspects, 10 clues, 1 red herring)."
    },
    {
      "checkId": "chk-metadata-consistency",
      "category": "runtime_state_issue",
      "status": "pass",
      "summary": "Case metadata status values (passed_with_minor_repository_issue, passed_with_minor_runtime_guidance) are valid current enum values in schemas/game-package.schema.json."
    }
  ],
  "findings": [],
  "clueCoverage": {
    "status": "pass",
    "summary": "All 10 essential and supporting clues are discoverable through valid discovery rules.",
    "checkedIds": [
      "clue-loose-service-panel",
      "clue-brass-dust",
      "clue-black-thread",
      "clue-clock-oil",
      "clue-stopped-clock",
      "clue-scraped-clock-latch",
      "clue-watch-in-clock",
      "clue-thomas-contradiction",
      "clue-thomas-money-note",
      "clue-celia-pawn-envelope"
    ],
    "missingIds": [],
    "riskIds": [],
    "relatedFindingIds": []
  },
  "discoveryRuleCoverage": {
    "status": "pass",
    "summary": "All 6 discovery rules use normalized schema triggerTypes.",
    "checkedIds": [
      "rule-case-inspection",
      "rule-clock-inspection",
      "rule-motive-discovery",
      "rule-red-herring",
      "rule-thomas-contradiction",
      "rule-final-accusation"
    ],
    "missingIds": [],
    "riskIds": [],
    "relatedFindingIds": []
  },
  "npcInterviewCoverage": {
    "status": "pass",
    "summary": "All 3 suspects have bounded interview topics, knowledge boundaries, and alibis.",
    "checkedIds": [
      "char-thomas-greer",
      "char-arthur-pendelton",
      "char-celia-vance"
    ],
    "missingIds": [],
    "riskIds": [],
    "relatedFindingIds": []
  },
  "timelineCoverage": {
    "status": "pass",
    "summary": "Timeline sequence is coherent without physical contradictions.",
    "checkedIds": [],
    "missingIds": [],
    "riskIds": [],
    "relatedFindingIds": []
  },
  "evidenceProvenanceCoverage": {
    "status": "pass",
    "summary": "All physical evidence items are tied to valid location/object discovery nodes.",
    "checkedIds": [],
    "missingIds": [],
    "riskIds": [],
    "relatedFindingIds": []
  },
  "imageSafetyCoverage": {
    "status": "pass",
    "summary": "Visual definitions for asset-display-case and asset-tallcase-clock comply with image safety rules and include complete text fallbacks.",
    "checkedIds": [
      "asset-display-case",
      "asset-tallcase-clock"
    ],
    "missingIds": [],
    "riskIds": [],
    "relatedFindingIds": []
  },
  "runtimeReadinessCoverage": {
    "status": "pass",
    "summary": "Canonical case package contains all data needed for GM execution.",
    "checkedIds": [],
    "missingIds": [],
    "riskIds": [],
    "relatedFindingIds": []
  },
  "caseBoardSafetyCoverage": {
    "status": "pass",
    "summary": "Initial case board seed uses neutral labels without solution spoilers.",
    "checkedIds": [],
    "missingIds": [],
    "riskIds": [],
    "relatedFindingIds": []
  },
  "recommendedRevisionPriority": "none",
  "revisionInputs": {
    "priorityFindingIds": [],
    "recommendedFilesToReview": [],
    "recommendedNextRole": "ai_playtester",
    "notesForRevisionEngine": "No revision needed; case passes validation cleanly."
  },
  "notes": "Revalidated in Step 6B using simplified AI_IF Validator role and tools/validate.py."
}
